{
  "default_river": 20,
  "default_mountain": 25,
  "default_plain": 25,
  "default_coast": 10,
  "default_general": 20,
  "MountainRange_river": 0,
  "MountainRange_mountain": 65,
  "MountainRange_plain": 5,
  "MountainRange_coast": 0,
  "MountainRange_general": 30,
  "Mountain_river": 5,
  "Mountain_mountain": 55,
  "Mountain_plain": 10,
  "Mountain_coast": 0,
  "Mountain_general": 30,
  "Plateau_river": 5,
  "Plateau_mountain": 30,
  "Plateau_plain": 30,
  "Plateau_coast": 0,
  "Plateau_general": 35,
  "Foothill_river": 10,
  "Foothill_mountain": 45,
  "Foothill_plain": 15,
  "Foothill_coast": 0,
  "Foothill_general": 30,
  "Hill_river": 10,
  "Hill_mountain": 35,
  "Hill_plain": 25,
  "Hill_coast": 0,
  "Hill_general": 30,
  "Basin_river": 30,
  "Basin_mountain": 5,
  "Basin_plain": 30,
  "Basin_coast": 0,
  "Basin_general": 35,
  "Plain_river": 15,
  "Plain_mountain": 5,
  "Plain_plain": 50,
  "Plain_coast": 0,
  "Plain_general": 30,
  "CoastalHill_river": 10,
  "CoastalHill_mountain": 20,
  "CoastalHill_plain": 15,
  "CoastalHill_coast": 30,
  "CoastalHill_general": 25,
  "CoastalPlain_river": 10,
  "CoastalPlain_mountain": 0,
  "CoastalPlain_plain": 30,
  "CoastalPlain_coast": 40,
  "CoastalPlain_general": 20,
  "Lake_river": 40,
  "Lake_mountain": 5,
  "Lake_plain": 20,
  "Lake_coast": 15,
  "Lake_general": 20,
  "Ocean_river": 5,
  "Ocean_mountain": 0,
  "Ocean_plain": 10,
  "Ocean_coast": 60,
  "Ocean_general": 25,
  "threeCharacterPeriod": 10
}
